{
  "metadata": {
    "title": "Learning Graphs: The Key to Intelligent Textbooks",
    "description": "A learning graph covering the data structures, standards, and workflows used to design, validate, visualize, and generate interactive intelligent textbooks \u2014 concept dependency graphs (CDGs), taxonomies, generative-AI concept enumeration, vis.js visualization, and the learning-science foundations that justify DAG-based instructional sequencing.",
    "creator": "Dan McCreary",
    "date": "2026-07-03",
    "version": "1.0",
    "format": "Learning Graph JSON v1.0",
    "schema": "https://raw.githubusercontent.com/dmccreary/learning-graphs/refs/heads/main/src/schema/learning-graph-schema.json",
    "license": "CC BY-NC-SA 4.0 DEED"
  },
  "groups": {
    "FOUND": {
      "classifierName": "Concept Graph Foundations",
      "color": "SteelBlue",
      "font": {
        "color": "white"
      }
    },
    "DEPEND": {
      "classifierName": "Concept Dependency & Prerequisites",
      "color": "DarkSlateBlue",
      "font": {
        "color": "white"
      }
    },
    "TAXON": {
      "classifierName": "Concept Taxonomies & Ontologies",
      "color": "DarkGreen",
      "font": {
        "color": "white"
      }
    },
    "QUAL": {
      "classifierName": "Graph Quality & Validation",
      "color": "LimeGreen",
      "font": {
        "color": "black"
      }
    },
    "EDUF": {
      "classifierName": "Educational Theory Foundations",
      "color": "Gold",
      "font": {
        "color": "black"
      }
    },
    "LSCI": {
      "classifierName": "Education & Learning Sciences",
      "color": "DarkGoldenrod",
      "font": {
        "color": "white"
      }
    },
    "PERS": {
      "classifierName": "Learning Paths & Personalization",
      "color": "Khaki",
      "font": {
        "color": "black"
      }
    },
    "AI": {
      "classifierName": "Intelligent Agents & Generative AI",
      "color": "Teal",
      "font": {
        "color": "white"
      }
    },
    "ASSESS": {
      "classifierName": "Assessment & Feedback",
      "color": "DodgerBlue",
      "font": {
        "color": "white"
      }
    },
    "VISCORE": {
      "classifierName": "Vis.js Fundamentals & Styling",
      "color": "LightSkyBlue",
      "font": {
        "color": "black"
      }
    },
    "VISLAYOUT": {
      "classifierName": "Graph Layout, Physics & Interactivity",
      "color": "Crimson",
      "font": {
        "color": "white"
      }
    },
    "VISTOOLS": {
      "classifierName": "Graph Clustering & Editing Tools",
      "color": "DarkRed",
      "font": {
        "color": "white"
      }
    },
    "DATA": {
      "classifierName": "Data Formats & File Standards",
      "color": "MediumPurple",
      "font": {
        "color": "white"
      }
    },
    "TEXTBOOK": {
      "classifierName": "Intelligent Textbooks & MicroSims",
      "color": "Indigo",
      "font": {
        "color": "white"
      }
    },
    "LMS": {
      "classifierName": "LMS & Deployment Infrastructure",
      "color": "DarkOrchid",
      "font": {
        "color": "white"
      }
    },
    "SKILL": {
      "classifierName": "Agent Skills for Learning Graph Generation",
      "color": "HotPink",
      "font": {
        "color": "black"
      }
    }
  },
  "nodes": [
    {
      "id": 1,
      "label": "Concept",
      "group": "FOUND",
      "shape": "box"
    },
    {
      "id": 2,
      "label": "Concept Graph",
      "group": "FOUND"
    },
    {
      "id": 3,
      "label": "Content Graph",
      "group": "FOUND"
    },
    {
      "id": 4,
      "label": "Knowledge Graph",
      "group": "FOUND"
    },
    {
      "id": 5,
      "label": "Dependency Graph",
      "group": "FOUND"
    },
    {
      "id": 6,
      "label": "Learning Graph",
      "group": "FOUND"
    },
    {
      "id": 7,
      "label": "Directed Graph",
      "group": "FOUND",
      "shape": "box"
    },
    {
      "id": 8,
      "label": "Directed Acyclic Graph (DAG)",
      "group": "FOUND"
    },
    {
      "id": 9,
      "label": "Node",
      "group": "FOUND",
      "shape": "box"
    },
    {
      "id": 10,
      "label": "Edge",
      "group": "FOUND"
    },
    {
      "id": 11,
      "label": "Hierarchy",
      "group": "FOUND"
    },
    {
      "id": 12,
      "label": "Graph Representation",
      "group": "FOUND"
    },
    {
      "id": 13,
      "label": "Cluster (Graph)",
      "group": "FOUND"
    },
    {
      "id": 14,
      "label": "Journey Map",
      "group": "FOUND"
    },
    {
      "id": 15,
      "label": "Hybrid Graph",
      "group": "FOUND"
    },
    {
      "id": 16,
      "label": "Concept Label",
      "group": "FOUND"
    },
    {
      "id": 17,
      "label": "Preferred Label",
      "group": "FOUND"
    },
    {
      "id": 18,
      "label": "Alternate Label",
      "group": "FOUND"
    },
    {
      "id": 19,
      "label": "SKOS",
      "group": "FOUND"
    },
    {
      "id": 20,
      "label": "ISO/IEC 11179",
      "group": "FOUND"
    },
    {
      "id": 21,
      "label": "Dublin Core Metadata",
      "group": "FOUND"
    },
    {
      "id": 22,
      "label": "Controlled Vocabulary",
      "group": "FOUND"
    },
    {
      "id": 23,
      "label": "Concept Definition",
      "group": "FOUND"
    },
    {
      "id": 24,
      "label": "Textbook Index",
      "group": "FOUND"
    },
    {
      "id": 25,
      "label": "Named Concept",
      "group": "FOUND"
    },
    {
      "id": 26,
      "label": "Concept Dependency",
      "group": "DEPEND"
    },
    {
      "id": 27,
      "label": "Prerequisite Relationship",
      "group": "DEPEND"
    },
    {
      "id": 28,
      "label": "Prerequisite Chain",
      "group": "DEPEND"
    },
    {
      "id": 29,
      "label": "Prerequisite Concept",
      "group": "DEPEND"
    },
    {
      "id": 30,
      "label": "Foundational Concept",
      "group": "DEPEND"
    },
    {
      "id": 31,
      "label": "Goal Concept",
      "group": "DEPEND"
    },
    {
      "id": 32,
      "label": "Immediate Goal",
      "group": "DEPEND"
    },
    {
      "id": 33,
      "label": "Intermediate Goal",
      "group": "DEPEND"
    },
    {
      "id": 34,
      "label": "Ultimate Goal",
      "group": "DEPEND"
    },
    {
      "id": 35,
      "label": "Learning Goal",
      "group": "DEPEND"
    },
    {
      "id": 36,
      "label": "Ready-to-Learn Concept",
      "group": "DEPEND"
    },
    {
      "id": 37,
      "label": "Learned Concept",
      "group": "DEPEND"
    },
    {
      "id": 38,
      "label": "Skill Gap",
      "group": "DEPEND"
    },
    {
      "id": 39,
      "label": "Transitive Dependency",
      "group": "DEPEND"
    },
    {
      "id": 40,
      "label": "Hop Count",
      "group": "DEPEND"
    },
    {
      "id": 41,
      "label": "Dependency Analysis",
      "group": "DEPEND"
    },
    {
      "id": 42,
      "label": "Concept Taxonomy",
      "group": "TAXON"
    },
    {
      "id": 43,
      "label": "Ontology",
      "group": "TAXON"
    },
    {
      "id": 44,
      "label": "TaxonomyID",
      "group": "TAXON"
    },
    {
      "id": 45,
      "label": "Taxonomy Classifier",
      "group": "TAXON"
    },
    {
      "id": 46,
      "label": "Taxonomy Category",
      "group": "TAXON"
    },
    {
      "id": 47,
      "label": "Taxonomy Distribution Report",
      "group": "TAXON"
    },
    {
      "id": 48,
      "label": "Taxonomy Legend",
      "group": "TAXON"
    },
    {
      "id": 49,
      "label": "Node Group",
      "group": "TAXON"
    },
    {
      "id": 50,
      "label": "Concept-to-Taxonomy Mapping",
      "group": "TAXON"
    },
    {
      "id": 51,
      "label": "Balanced Taxonomy",
      "group": "TAXON"
    },
    {
      "id": 52,
      "label": "Miscellaneous Category",
      "group": "TAXON"
    },
    {
      "id": 53,
      "label": "Abstraction (Graph)",
      "group": "TAXON"
    },
    {
      "id": 54,
      "label": "Clustering (Graph)",
      "group": "TAXON"
    },
    {
      "id": 55,
      "label": "Learning Graph Validation",
      "group": "QUAL"
    },
    {
      "id": 56,
      "label": "Graph Quality Metric",
      "group": "QUAL"
    },
    {
      "id": 57,
      "label": "Orphaned Node",
      "group": "QUAL"
    },
    {
      "id": 58,
      "label": "Disconnected Subgraph",
      "group": "QUAL"
    },
    {
      "id": 59,
      "label": "Cycle Detection",
      "group": "QUAL"
    },
    {
      "id": 60,
      "label": "Self-Dependency Prevention",
      "group": "QUAL"
    },
    {
      "id": 61,
      "label": "Indegree",
      "group": "QUAL"
    },
    {
      "id": 62,
      "label": "Out-Degree",
      "group": "QUAL"
    },
    {
      "id": 63,
      "label": "Node Degree",
      "group": "QUAL"
    },
    {
      "id": 64,
      "label": "Full Coverage Check",
      "group": "QUAL"
    },
    {
      "id": 65,
      "label": "Structural Check",
      "group": "QUAL"
    },
    {
      "id": 66,
      "label": "Graph Connectivity",
      "group": "QUAL"
    },
    {
      "id": 67,
      "label": "Quality Metrics Report",
      "group": "QUAL"
    },
    {
      "id": 68,
      "label": "Third-Party Certification",
      "group": "QUAL"
    },
    {
      "id": 69,
      "label": "Bloom's Taxonomy",
      "group": "EDUF",
      "shape": "box"
    },
    {
      "id": 70,
      "label": "Cognitive Domain",
      "group": "EDUF"
    },
    {
      "id": 71,
      "label": "Affective Domain",
      "group": "EDUF"
    },
    {
      "id": 72,
      "label": "Psychomotor Domain",
      "group": "EDUF"
    },
    {
      "id": 73,
      "label": "Remembering",
      "group": "EDUF"
    },
    {
      "id": 74,
      "label": "Understanding",
      "group": "EDUF"
    },
    {
      "id": 75,
      "label": "Applying",
      "group": "EDUF"
    },
    {
      "id": 76,
      "label": "Analyzing",
      "group": "EDUF"
    },
    {
      "id": 77,